### ISSUE TITLE
NLB (type=internal) + ETP=local + Client IP Preservation needs to be fixed

### ISSUE THREAD

**Issue by tssurya** [kubernetes/cloud-provider-aws#564]
**What happened**:
Created a load balancer of type NLB:

```
$ oc describe svc -n openshift-ingress router-router-internal-nlb
Name:                     router-router-internal-nlb
Namespace:                openshift-ingress
Labels:                   app=router
                          ingresscontroller.operator.openshift.io/owning-ingresscontroller=router-internal-nlb
                          router=router-router-internal-nlb
Annotations:              service.beta.kubernetes.io/aws-load-balancer-healthcheck-healthy-threshold: 2
                          service.beta.kubernetes.io/aws-load-balancer-healthcheck-interval: 10
                          service.beta.kubernetes.io/aws-load-balancer-healthcheck-timeout: 4
                          service.beta.kubernetes.io/aws-load-balancer-healthcheck-unhealthy-threshold: 2
                          service.beta.kubernetes.io/aws-load-balancer-internal: true
                          service.beta.kubernetes.io/aws-load-balancer-type: nlb
                          traffic-policy.network.alpha.openshift.io/local-with-fallback: 
Selector:                 ingresscontroller.operator.openshift.io/deployment-ingresscontroller=router-internal-nlb
Type:                     LoadBalancer
IP Family Policy:         SingleStack
IP Families:              IPv4
IP:                       172.30.57.241
IPs:                      172.30.57.241
LoadBalancer Ingress:     a0935eb5632a340f6b3e5487d3298847-5cea615e1ac1af7e.elb.us-west-1.amazonaws.com
Port:                     http  80/TCP
TargetPort:               http/TCP
NodePort:                 http  31056/TCP
Endpoints:                10.131.0.17:80
Port:                     https  443/TCP
TargetPort:               https/TCP
NodePort:                 https  31569/TCP
Endpoints:                10.131.0.17:443
Session Affinity:         None
External Traffic Policy:  Local
HealthCheck NodePort:     30882
```

```
$ oc get pods -n openshift-ingress -owide                                                                                                
NAME                                          READY   STATUS    RESTARTS   AGE   IP            NODE                                        NOMINATED NODE   READINESS GATES  
router-default-6bc948b565-5pncp               1/1     Running   0          71m   10.131.0.7    ip-10-0-171-72.us-west-1.compute.internal   <none>           <none>           
router-default-6bc948b565-jcwtv               1/1     Running   0          71m   10.128.2.11   ip-10-0-190-96.us-west-1.compute.internal   <none>           <none>           
router-router-internal-nlb-7f68bc757f-dpgbr   1/1     Running   0          56s   10.131.0.17   ip-10-0-171-72.us-west-1.compute.internal   <none>           <none> 
```

router-router-internal-nlb-7f68bc757f-dpgbr is the backend of the LB svc.

```
ETP=local so let's pick the node where there is both router-nlb pod and router-default pod:

$ oc rsh -n openshift-ingress router-default-6bc948b565-5pncp
sh-4.4$ dig +short a0935eb5632a340f6b3e5487d3298847-5cea615e1ac1af7e.elb.us-west-1.amazonaws.com
10.0.163.109
sh-4.4$ curl --local-port 36363 10.0.163.109
curl: (7) Failed to connect to 10.0.163.109 port 80: Connection timed out
```
Traffic flow: pod (router-default-6bc948b565-5pncp) ->LBVIP (10.0.163.109) 
This traffic flow breaks. Since Client IP Preservation is enabled, the packet goes out of the cluster to AWS LB Node and comes back in with srcIP == nodeIP of the originating node. This hairpin case where the srcPod and dstPod are on same node doesn't work and its a werid scenario that CNI plugins don't anticipate. 

TCPDUMP:
```
Traffic going out of the cluster:
tcpdump: listening on any, link-type LINUX_SLL (Linux cooked v1), capture size 262144 bytes                                                                                  
09:53:21.301824   P 0a:58:0a:83:00:07 ethertype IPv4 (0x0800), length 76: (tos 0x0, ttl 64, id 25158, offset 0, flags [DF], proto TCP (6), length 60)                        
    10.131.0.7.36363 > 10.0.163.109.80: Flags [S], cksum 0xb825 (incorrect -> 0x530b), seq 3046883424, win 26583, options [mss 8861,sackOK,TS val 982481238 ecr 0,nop,wscale 
7], length 0                                                                                                                                                                 
09:53:21.302752 Out 06:d1:d3:93:8b:d9 ethertype IPv4 (0x0800), length 76: (tos 0x0, ttl 62, id 25158, offset 0, flags [DF], proto TCP (6), length 60)                        
    10.0.171.72.36363 > 10.0.163.109.80: Flags [S], cksum 0xa84c (correct), seq 3046883424, win 26583, options [mss 8861,sackOK,TS val 982481238 ecr 0,nop,wscale 7], length 
0                                      

Traffic coming back into the cluster:                                                                                                                                      
09:53:21.303227  In 06:b2:f4:da:68:9d ethertype IPv4 (0x0800), length 76: (tos 0x0, ttl 61, id 25158, offset 0, flags [DF], proto TCP (6), length 60)                        
    10.0.171.72.36363 > 10.0.171.72.31056: Flags [S], cksum 0x2961 (correct), seq 3046883424, win 26583, options [mss 8365,sackOK,TS val 982481238 ecr 0,nop,wscale 7], lengt
h 0                                                                
```

I think this should be fixed on AWS side to either:

1) Either turn off clientIP preservation for such cases of NLB+privateIP LBVIP so that hairpin case can work and document this. (its not like users have access to aws console always to do this, at creation time this needs to be done auto by AWS) - though note that by definition of ETP=local ; it means the srcIP of the client MUST be preserved (its what other providers do as well)
2) OR create .IP type load balancers instead of hostnames so that CNI plugins can have rules within the cluster that can shortcircuit this traffic like we do for GCP/Azure.

Reproducible on all versions.

**What you expected to happen**:

**How to reproduce it (as minimally and precisely as possible)**:

**Anything else we need to know?**:

**Environment**:
- Kubernetes version (use `kubectl version`):
- Cloud provider or hardware configuration:
- OS (e.g. from /etc/os-release):
- Kernel (e.g. `uname -a`):
- Install tools:
- Others:

/kind bug

**Comment by tssurya** [comment]
fyi, had some discussions here: https://kubernetes.slack.com/archives/C0LRMHZ1T/p1673418407693559 around this, but even if the workaround is to disable clientIP preservation (which was suggested in the thread), that contradicts with the etp=local definition of a svc.

**Comment by gcs278** [comment]
+1 to option 2:
> OR create .IP type load balancers instead of hostnames so that CNI plugins can have rules within the cluster that can shortcircuit this traffic like we do for GCP/Azure.

I drew up a diagram, which describes the situation @tssurya is referring to:
![image](https://user-images.githubusercontent.com/4316443/216374856-a3f2b124-0fdc-4ddc-98bb-6f9ee1660f48.png)

_Just to recap what I know_-

**Summarizing the problem:** When AWS internal NLBs have Client IP Preservation On (on by default), connections fail from pods that are co-located (same node) with the destination app. This is because kube-proxy receives a connection from the NLB with a preserved source IP (the node IP) that it doesn’t have a DNAT mapping for and is unable to rewrite it further. The destination IP is the node IP, so the packet has to be delivered locally, but there is no open socket on the node that has that 5-tuple. Therefore, the packet gets dropped. This is a [known issue](https://docs.aws.amazon.com/elasticloadbalancing/latest/network/load-balancer-troubleshooting.html#loopback-timeout) with NLBs and AWS instructs users to turn off Client IP Preservation or dedicate nodes so that containers are never co-located on the same node.

**A solution to the problem:** Specifically, setting the `status.loadbalancer.ingress.ip` field when Client IP Preservation is turned on for NLBs, would indicate to kube-proxy that it could implement this short-circuiting logic, resolving this limitation. The `.ip` field could be set in addition to the `.hostname` if Client IP Preservation is enabled (the `.hostname` doesn’t need to be cleared). My understanding is that the `.hostname` vs. `.ip` designation has become a de facto standard to indicate to kube-proxy whether short-circuiting could occur, as supported by this [kubernetes-sigs kpng](https://github.com/kubernetes-sigs/kpng/blob/master/doc/service-proxy.md#load-balancer-ips) doc.

Could the cloud-provider set this `.ip` field so that kube-proxy could resolve this issue via short-circuting?

**Comment by neoakris** [comment]
Note this might help think of the project like CSI driver (add on storage class functionality), only it's an add-on that changes LB controller functionality. 
https://kubernetes-sigs.github.io/aws-load-balancer-controller/v2.4/

**Comment by elmiko** [comment]
> Could the cloud-provider set this .ip field so that kube-proxy could resolve this issue via short-circuting?

a couple questions i have after looking at the code in cloud-provider-aws is how would the cloud-provider determine the ip of the nlb? (i'm guessing some metadata service call)
and, would the ip address of the nlb ever change such that the controller would need to update the ip address in the status?

further, i wonder if this would just take patching these functions to do the ip address lookup?

https://github.com/kubernetes/cloud-provider-aws/blob/master/pkg/providers/v1/aws.go#L4488

https://github.com/kubernetes/cloud-provider-aws/blob/master/pkg/providers/v1/aws.go#L4506

i didn't see the ip address contained in the struct that has the dns name that is used in the `hostname` field, so i'm not sure if that value would be injected somewhere or would need to be looked up in the status function, or something else entirely.

**Comment by nckturner** [comment]
cc @kishorj @M00nF1sh @josh-ferrell

**Comment by kishorj** [comment]
@tssurya, you could the external aws-load-balancer-controller https://github.com/kubernetes-sigs/aws-load-balancer-controller/ instead. We support provisioning NLB with target group attributes with the external controller, https://kubernetes-sigs.github.io/aws-load-balancer-controller/v2.4/guide/service/annotations/#target-group-attributes

We recommend configuring your service resource with `spec.loadBalancerClass` set. Please refer to the live docs https://kubernetes-sigs.github.io/aws-load-balancer-controller/v2.4/guide/service/nlb/#configuration for further details.

**Comment by gcs278** [comment]
> you could the external aws-load-balancer-controller

@kishorj For my and @tssurya's use case (OpenShift), we have an equivalent operator, the https://github.com/openshift/cluster-ingress-operator/ which configures ingress for a variety of platforms. Adding the aws-load-balancer-controller operator on top of this existing operator is undesirable and adds a lot more complexity.

> We support provisioning NLB with target group attributes with the external controller

In addition, are you suggesting to disable the `preserve_client_ip.enabled` [target group attribute](https://docs.aws.amazon.com/elasticloadbalancing/latest/network/load-balancer-target-groups.html#target-group-attributes)? This would solve this problem; however, we do want client IP preservation, as we have other feature that rely on the our downstream proxies being presented with the correct source IP address. Even if we could use the aws-load-balancer-controller, I think we would still have issues as I don't think any target group attributes address the root problem.

**Comment by gcs278** [comment]
Any updates or progress on this issue?

**Comment by gcs278** [comment]
Any updates or progress on this issue?

**Comment by kishorj** [comment]
The support for the `.IP` loadbalancer is a feature of kube-proxy. If IP fields are set, I see kube-proxy create the necessary rules to forward teh traffic to the pods. I was able to manually edit an existing service and specify the IP addresses, the hairpin issue was no longer there. 

The problem now boils down to how to to ensure the IPs are up to date. In case of default "assigned by AWS", the DNS records have a ttl of 60 seconds, need to keep the addresses updated. Controller watching for the changes and updating the status field doesn't completely solve the hairpin issue.

One option is to to base it on the static IP configured by the end user via annotation (the AWS LBC supports this feature).

**Comment by elmiko** [comment]
> One option is to to base it on the static IP configured by the end user via annotation (the AWS LBC supports this feature).

this seems like a straightforward and explicit way for the user to fix the issue, would it require changes to the cloud-provider code to detect the annotation?
